<?xml version="1.0" encoding="UTF-8" standalone="no"?>
<!--
 *
 * (c) Kitodo. Key to digital objects e. V. <contact@kitodo.org>
 *
 * This file is part of the Kitodo project.
 *
 * It is licensed under GNU General Public License version 3 or later.
 *
 * For the full copyright and license information, please read the
 * GPL3-License.txt file that was distributed with this source code.
 *
-->
<ruleset xmlns="http://names.kitodo.org/ruleset/v2"
         xmlns:xsi="http://www.w3.org/2001/XMLSchema-instance"
         xsi:schemaLocation="http://names.kitodo.org/ruleset/v2 ../../../../../Kitodo-DataEditor/src/main/resources/ruleset.xsd">
    <declaration>
        <division id="Monograph" processTitle="TSL_ATS+'_'+CatalogIDDigital">
            <label>Monograph</label>
        </division>
        <division id="something">
            <label>Outline element</label>
        </division>
        <division id="ContainedWork" processTitle="TSL_ATS+'_'+CatalogIDDigital">
            <label>Beigef√ºgtes Werk</label>
        </division>
        <key id="TitleDocMain" domain="source">
            <label>HauptTitel</label>
        </key>
        <key id="TitleDocMainShort" domain="technical">
            <label>Haupttitel (Sortierung)</label>
        </key>
        <key id="TSL_ATS">
            <label>TSL/ATS</label>
        </key>
        <key id="CatalogIDDigital">
            <label>PPN (digital)</label>
        </key>
        <key id="CatalogIDSource" domain="source">
            <label>PPN (Vorlage)</label>
        </key>
        <key id="Person">
            <label>Person</label>
            <key id="Role">
                <label>Rolle</label>
                <option value="Author">
                    <label>Autor</label>
                </option>
            </key>
            <key id="FirstName">
                <label>Vorname</label>
            </key>
            <key id="LastName">
                <label>Nachname</label>
            </key>
        </key>
    </declaration>
    <correlation>
        <restriction key="Person">
            <permit key="Role" minOccurs="1" maxOccurs="1"/>
            <permit key="FirstName"/>
            <permit key="LastName"/>
        </restriction>

        <restriction division="Monograph" unspecified="forbidden">
            <permit division="Monograph"/>
            <permit key="TitleDocMain" minOccurs="1"/>
            <permit key="TitleDocMainShort" minOccurs="1"/>
            <permit key="CatalogIDDigital" minOccurs="1"/>
            <permit key="CatalogIDSource" minOccurs="1"/>
            <permit key="TSL_ATS"/>
            <permit key="Person">
                <permit key="Role" unspecified="forbidden">
                    <permit value="Author"/>
                </permit>
            </permit>
        </restriction>
        <restriction division="ContainedWork" unspecified="forbidden">
                <permit key="TitleDocMain" minOccurs="1"/>
                <permit key="TitleDocMainShort" minOccurs="1"/>
                <permit key="CatalogIDDigital" minOccurs="1"/>
            <permit key="CatalogIDSource" minOccurs="1"/>
            <permit key="TSL_ATS"/>
        </restriction>
    </correlation>
    <editing>
        <setting key="TSL_ATS" alwaysShowing="true"/>
        <setting key="Person" alwaysShowing="true">
            <setting key="FirstName" alwaysShowing="true"/>
            <setting key="LastName" alwaysShowing="true"/>
        </setting>
    </editing>
</ruleset>
